15:22:28.041783 IP oldschool30.runescape.com.https > 192.168.0.104.52558: Flags [P.], seq 1574347026:1574347059, ack 2827770028, win 112, options [nop,nop,TS val 337969736 ecr 278361707], length 33
15:22:28.087903 IP 192.168.0.104.52558 > oldschool30.runescape.com.https: Flags [.], ack 33, win 438, options [nop,nop,TS val 278361852 ecr 337969736], length 0
15:22:28.523504 IP 192.168.0.104.52558 > oldschool30.runescape.com.https: Flags [P.], seq 1:2, ack 33, win 438, options [nop,nop,TS val 278361961 ecr 337969736], length 1
15:22:28.622272 IP oldschool30.runescape.com.https > 192.168.0.104.52558: Flags [.], ack 2, win 112, options [nop,nop,TS val 337969794 ecr 278361961], length 0
15:22:28.623576 IP oldschool30.runescape.com.https > 192.168.0.104.52558: Flags [P.], seq 33:96, ack 2, win 112, options [nop,nop,TS val 337969794 ecr 278361961], length 63
15:22:28.623588 IP 192.168.0.104.52558 > oldschool30.runescape.com.https: Flags [.], ack 96, win 438, options [nop,nop,TS val 278361986 ecr 337969794], length 0
15:22:28.645158 IP 192.168.0.104.52558 > oldschool30.runescape.com.https: Flags [P.], seq 2:13, ack 96, win 438, options [nop,nop,TS val 278361992 ecr 337969794], length 11
15:22:28.778719 IP oldschool30.runescape.com.https > 192.168.0.104.52558: Flags [.], ack 13, win 112, options [nop,nop,TS val 337969810 ecr 278361992], length 0
15:22:28.916670 IP 192.168.0.1.51362 > 255.255.255.255.7437: UDP, length 173
15:22:28.996337 IP 192.168.0.104.58631 > 192.168.0.1.domain: 7768+ PTR? 104.0.168.192.in-addr.arpa. (44)
15:22:28.996989 IP 192.168.0.1.domain > 192.168.0.104.58631: 7768 NXDomain- 0/0/0 (44)
15:22:28.997252 IP 192.168.0.104.58631 > 192.168.0.1.domain: 1836+ PTR? 175.17.42.8.in-addr.arpa. (42)
15:22:29.177167 IP 192.168.0.1.domain > 192.168.0.104.58631: 1836 1/0/0 PTR oldschool30.runescape.com. (81)
15:22:29.177671 IP 192.168.0.104.58631 > 192.168.0.1.domain: 22975+ PTR? 255.255.255.255.in-addr.arpa. (46)
15:22:29.178462 IP 192.168.0.1.domain > 192.168.0.104.58631: 22975 NXDomain- 0/0/0 (46)
15:22:29.178724 IP 192.168.0.104.58631 > 192.168.0.1.domain: 13823+ PTR? 1.0.168.192.in-addr.arpa. (42)
15:22:29.179252 IP 192.168.0.1.domain > 192.168.0.104.58631: 13823 NXDomain- 0/0/0 (42)
15:22:29.184844 IP 192.168.0.104.52558 > oldschool30.runescape.com.https: Flags [P.], seq 13:15, ack 96, win 438, options [nop,nop,TS val 278362127 ecr 337969810], length 2
15:22:29.283570 IP oldschool30.runescape.com.https > 192.168.0.104.52558: Flags [.], ack 15, win 112, options [nop,nop,TS val 337969860 ecr 278362127], length 0
15:22:29.390328 IP oldschool30.runescape.com.https > 192.168.0.104.52558: Flags [P.], seq 96:159, ack 15, win 112, options [nop,nop,TS val 337969871 ecr 278362127], length 63
15:22:29.402561 IP 192.168.0.104.52558 > oldschool30.runescape.com.https: Flags [P.], seq 15:26, ack 159, win 438, options [nop,nop,TS val 278362181 ecr 337969871], length 11
15:22:29.501403 IP oldschool30.runescape.com.https > 192.168.0.104.52558: Flags [.], ack 26, win 112, options [nop,nop,TS val 337969882 ecr 278362181], length 0
15:22:29.913287 IP oldschool30.runescape.com.https > 192.168.0.104.52558: Flags [P.], seq 159:187, ack 26, win 112, options [nop,nop,TS val 337969923 ecr 278362181], length 28
15:22:29.955929 IP 192.168.0.104.52558 > oldschool30.runescape.com.https: Flags [.], ack 187, win 438, options [nop,nop,TS val 278362320 ecr 337969923], length 0
15:22:30.423519 IP 192.168.0.104.52558 > oldschool30.runescape.com.https: Flags [P.], seq 26:27, ack 187, win 438, options [nop,nop,TS val 278362436 ecr 337969923], length 1
15:22:30.489419 IP oldschool30.runescape.com.https > 192.168.0.104.52558: Flags [P.], seq 187:213, ack 26, win 112, options [nop,nop,TS val 337969981 ecr 278362320], length 26
15:22:30.489445 IP 192.168.0.104.52558 > oldschool30.runescape.com.https: Flags [.], ack 213, win 438, options [nop,nop,TS val 278362453 ecr 337969981], length 0
15:22:30.522156 IP oldschool30.runescape.com.https > 192.168.0.104.52558: Flags [.], ack 27, win 112, options [nop,nop,TS val 337969984 ecr 278362436], length 0
15:22:31.035598 IP oldschool30.runescape.com.https > 192.168.0.104.52558: Flags [P.], seq 213:249, ack 27, win 112, options [nop,nop,TS val 337970035 ecr 278362453], length 36
15:22:31.035620 IP 192.168.0.104.52558 > oldschool30.runescape.com.https: Flags [.], ack 249, win 438, options [nop,nop,TS val 278362589 ecr 337970035], length 0
15:22:31.041952 IP 192.168.0.104.52558 > oldschool30.runescape.com.https: Flags [P.], seq 27:42, ack 249, win 438, options [nop,nop,TS val 278362591 ecr 337970035], length 15
15:22:31.140818 IP oldschool30.runescape.com.https > 192.168.0.104.52558: Flags [.], ack 42, win 112, options [nop,nop,TS val 337970046 ecr 278362591], length 0
15:22:31.182202 IP 192.168.0.104.52558 > oldschool30.runescape.com.https: Flags [P.], seq 42:44, ack 249, win 438, options [nop,nop,TS val 278362626 ecr 337970046], length 2
15:22:31.280926 IP oldschool30.runescape.com.https > 192.168.0.104.52558: Flags [.], ack 44, win 112, options [nop,nop,TS val 337970060 ecr 278362626], length 0
15:22:31.703942 IP oldschool30.runescape.com.https > 192.168.0.104.52558: Flags [P.], seq 249:280, ack 44, win 112, options [nop,nop,TS val 337970102 ecr 278362626], length 31
15:22:31.747925 IP 192.168.0.104.52558 > oldschool30.runescape.com.https: Flags [.], ack 280, win 438, options [nop,nop,TS val 278362768 ecr 337970102], length 0
15:22:31.940717 IP 192.168.0.1.51362 > 255.255.255.255.7437: UDP, length 173
15:22:31.982468 IP 192.168.0.104.57621 > 192.168.0.255.57621: UDP, length 44
15:22:32.068142 IP 192.168.0.104.58631 > 192.168.0.1.domain: 36363+ PTR? 255.0.168.192.in-addr.arpa. (44)
15:22:32.082768 IP 192.168.0.1.domain > 192.168.0.104.58631: 36363 NXDomain 0/0/0 (44)
15:22:32.201932 IP 192.168.0.104.52558 > oldschool30.runescape.com.https: Flags [P.], seq 44:45, ack 280, win 438, options [nop,nop,TS val 278362881 ecr 337970102], length 1
15:22:32.246671 IP oldschool30.runescape.com.https > 192.168.0.104.52558: Flags [P.], seq 280:324, ack 44, win 112, options [nop,nop,TS val 337970156 ecr 278362768], length 44
15:22:32.246686 IP 192.168.0.104.52558 > oldschool30.runescape.com.https: Flags [.], ack 324, win 438, options [nop,nop,TS val 278362892 ecr 337970156], length 0
15:22:32.300584 IP oldschool30.runescape.com.https > 192.168.0.104.52558: Flags [.], ack 45, win 112, options [nop,nop,TS val 337970162 ecr 278362881], length 0
15:22:32.845365 IP oldschool30.runescape.com.https > 192.168.0.104.52558: Flags [P.], seq 324:377, ack 45, win 112, options [nop,nop,TS val 337970216 ecr 278362892], length 53
15:22:32.845390 IP 192.168.0.104.52558 > oldschool30.runescape.com.https: Flags [.], ack 377, win 438, options [nop,nop,TS val 278363042 ecr 337970216], length 0
15:22:32.863751 IP 192.168.0.104.52558 > oldschool30.runescape.com.https: Flags [P.], seq 45:60, ack 377, win 438, options [nop,nop,TS val 278363046 ecr 337970216], length 15
15:22:32.962542 IP oldschool30.runescape.com.https > 192.168.0.104.52558: Flags [.], ack 60, win 112, options [nop,nop,TS val 337970228 ecr 278363046], length 0
15:22:33.183877 IP 192.168.0.104.52558 > oldschool30.runescape.com.https: Flags [P.], seq 60:62, ack 377, win 438, options [nop,nop,TS val 278363126 ecr 337970228], length 2
15:22:33.282710 IP oldschool30.runescape.com.https > 192.168.0.104.52558: Flags [.], ack 62, win 112, options [nop,nop,TS val 337970260 ecr 278363126], length 0
15:22:33.428190 IP oldschool30.runescape.com.https > 192.168.0.104.52558: Flags [P.], seq 377:414, ack 62, win 112, options [nop,nop,TS val 337970274 ecr 278363126], length 37
15:22:33.471960 IP 192.168.0.104.52558 > oldschool30.runescape.com.https: Flags [.], ack 414, win 438, options [nop,nop,TS val 278363199 ecr 337970274], length 0
15:22:34.066231 IP oldschool30.runescape.com.https > 192.168.0.104.52558: Flags [P.], seq 414:443, ack 62, win 112, options [nop,nop,TS val 337970338 ecr 278363199], length 29
15:22:34.066257 IP 192.168.0.104.52558 > oldschool30.runescape.com.https: Flags [.], ack 443, win 438, options [nop,nop,TS val 278363347 ecr 337970338], length 0
15:22:34.202205 IP 192.168.0.104.52558 > oldschool30.runescape.com.https: Flags [P.], seq 62:63, ack 443, win 438, options [nop,nop,TS val 278363381 ecr 337970338], length 1
15:22:34.301090 IP oldschool30.runescape.com.https > 192.168.0.104.52558: Flags [.], ack 63, win 112, options [nop,nop,TS val 337970362 ecr 278363381], length 0
15:22:34.700275 IP oldschool30.runescape.com.https > 192.168.0.104.52558: Flags [P.], seq 443:501, ack 63, win 112, options [nop,nop,TS val 337970402 ecr 278363381], length 58
15:22:34.700309 IP 192.168.0.104.52558 > oldschool30.runescape.com.https: Flags [.], ack 501, win 438, options [nop,nop,TS val 278363506 ecr 337970402], length 0
15:22:34.704891 IP 192.168.0.104.52558 > oldschool30.runescape.com.https: Flags [P.], seq 63:74, ack 501, win 438, options [nop,nop,TS val 278363507 ecr 337970402], length 11
15:22:34.803572 IP oldschool30.runescape.com.https > 192.168.0.104.52558: Flags [.], ack 74, win 112, options [nop,nop,TS val 337970412 ecr 278363507], length 0
15:22:34.964778 IP 192.168.0.1.51362 > 255.255.255.255.7437: UDP, length 173
15:22:35.202358 IP 192.168.0.104.52558 > oldschool30.runescape.com.https: Flags [P.], seq 74:76, ack 501, win 438, options [nop,nop,TS val 278363631 ecr 337970412], length 2
15:22:35.240950 IP oldschool30.runescape.com.https > 192.168.0.104.52558: Flags [P.], seq 501:530, ack 74, win 112, options [nop,nop,TS val 337970456 ecr 278363507], length 29
15:22:35.283904 IP 192.168.0.104.52558 > oldschool30.runescape.com.https: Flags [.], ack 530, win 438, options [nop,nop,TS val 278363652 ecr 337970456], length 0
15:22:35.294435 IP 192.168.0.104.57018 > 104.20.97.31.https: Flags [P.], seq 2245760342:2245760373, ack 33079729, win 247, length 31
15:22:35.294480 IP 192.168.0.104.57018 > 104.20.97.31.https: Flags [F.], seq 31, ack 1, win 247, length 0
15:22:35.301157 IP oldschool30.runescape.com.https > 192.168.0.104.52558: Flags [.], ack 76, win 112, options [nop,nop,TS val 337970462 ecr 278363631], length 0
15:22:35.304588 IP 104.20.97.31.https > 192.168.0.104.57018: Flags [F.], seq 1, ack 31, win 31, length 0
15:22:35.304614 IP 192.168.0.104.57018 > 104.20.97.31.https: Flags [.], ack 2, win 247, length 0
15:22:35.305246 IP 104.20.97.31.https > 192.168.0.104.57018: Flags [.], ack 32, win 31, length 0
15:22:35.945939 IP oldschool30.runescape.com.https > 192.168.0.104.52558: Flags [P.], seq 530:562, ack 76, win 112, options [nop,nop,TS val 337970526 ecr 278363652], length 32
15:22:35.945957 IP 192.168.0.104.52558 > oldschool30.runescape.com.https: Flags [.], ack 562, win 438, options [nop,nop,TS val 278363817 ecr 337970526], length 0

